"DESCRIPTION","DURATION IN MS","NAME","PARENT SUITE","START TIME","STATUS","STOP TIME","SUB SUITE","SUITE","TEST CLASS","TEST METHOD"
"Tests precision-recall curve calculations.","84","test_get_pr_curve","tests.unit_test.utils_test","Fri Dec 05 15:44:24 UTC 2025","passed","Fri Dec 05 15:44:24 UTC 2025","","metrics_test","",""
"Test knapsack creation, loading, and functionality.","4506","test_knapsack","tests.integration","Fri Dec 05 15:44:17 UTC 2025","passed","Fri Dec 05 15:44:21 UTC 2025","","knapsack_test","",""
"Test the 'predict' command of the instanovo_cli with no data path.","183","test_no_data_path[args1]","tests.unit_test","Fri Dec 05 15:45:22 UTC 2025","passed","Fri Dec 05 15:45:22 UTC 2025","","cli_test","",""
"Test when MPS is available.","5","test_mps_available","tests.unit_test.utils_test","Fri Dec 05 15:44:24 UTC 2025","passed","Fri Dec 05 15:44:24 UTC 2025","TestGetDeviceCapabilities","device_handler_test","",""
"Test when CUDA is not available and force_cpu is False.","4","test_cuda_not_available_no_force_cpu","tests.unit_test.utils_test","Fri Dec 05 15:44:24 UTC 2025","passed","Fri Dec 05 15:44:24 UTC 2025","TestValidateAndConfigureDevice","device_handler_test","",""
"Test the 'predict' command of the instanovo_cli with a nonexisting config path.","12","test_predict_nonexisting_config_path[cli1]","tests.unit_test","Fri Dec 05 15:45:19 UTC 2025","passed","Fri Dec 05 15:45:19 UTC 2025","","cli_test","",""
"Test the 'predict' command of the instanovo_cli with a nonexisting data path.","186","test_nonexisting_data_path[args0]","tests.unit_test","Fri Dec 05 15:45:22 UTC 2025","passed","Fri Dec 05 15:45:22 UTC 2025","","cli_test","",""
"Test residue mass.","1","test_get_mass","tests.unit_test.utils_test","Fri Dec 05 15:44:24 UTC 2025","passed","Fri Dec 05 15:44:24 UTC 2025","","residues_test","",""
"Test the 'predict' command of the instanovo cli with a file with a non-supported suffix.","185","test_instanovo_model_suffix[args0]","tests.unit_test","Fri Dec 05 15:45:21 UTC 2025","passed","Fri Dec 05 15:45:21 UTC 2025","","cli_test","",""
"Test residue decoder.","0","test_decoder","tests.unit_test.utils_test","Fri Dec 05 15:44:24 UTC 2025","passed","Fri Dec 05 15:44:24 UTC 2025","","residues_test","",""
"Test loading an InstaNovo model and doing inference end-to-end.","1560","test_transformer_model","tests.integration","Fri Dec 05 15:44:21 UTC 2025","passed","Fri Dec 05 15:44:23 UTC 2025","","instanovo_model_test","",""
"Test training an InstaNovo model and doing inference end-to-end.","0","test_train_model","tests.integration","Fri Dec 05 15:44:24 UTC 2025","skipped","Fri Dec 05 15:44:24 UTC 2025","","instanovoplus_model_train_test","",""
"Test handling of request exception during download.","4","test_get_zenodo_request_exception","tests.scripts","Fri Dec 05 15:44:24 UTC 2025","passed","Fri Dec 05 15:44:24 UTC 2025","TestZenodoDownload","get_zenodo_record_test","",""
"Test when both CUDA and MPS are available.","5","test_both_available","tests.unit_test.utils_test","Fri Dec 05 15:44:24 UTC 2025","passed","Fri Dec 05 15:44:24 UTC 2025","TestGetDeviceCapabilities","device_handler_test","",""
"Test spectrum dataset specified initialisation.","607","test_dataset_spec_init","tests.unit_test.transformer_test","Fri Dec 05 15:45:33 UTC 2025","passed","Fri Dec 05 15:45:33 UTC 2025","","dataset_test","",""
"Test loading an InstaNovo+ model and doing inference end-to-end.","20201","test_model","tests.integration","Fri Dec 05 15:43:50 UTC 2025","passed","Fri Dec 05 15:44:11 UTC 2025","","instanovoplus_model_test","",""
"Tests splitting of sequence.","0","test_split_sequences","tests.unit_test.utils_test","Fri Dec 05 15:44:24 UTC 2025","passed","Fri Dec 05 15:44:24 UTC 2025","","metrics_test","",""
"Tests setting of GCP credentials.","8","test_set_credentials","tests.unit_test.scripts_test","Fri Dec 05 15:44:36 UTC 2025","passed","Fri Dec 05 15:44:36 UTC 2025","","set_gcp_credentials_test","",""
"Test the main command help text is displayed.","19","test_main_help[args3-Run predictions or train with only the diffusion-based InstaNovo+ model.]","tests.unit_test","Fri Dec 05 15:45:31 UTC 2025","passed","Fri Dec 05 15:45:31 UTC 2025","","cli_test","",""
"Test InstaNovo model initialisation and methods.","1646","test_model_init","tests.unit_test.transformer_test","Fri Dec 05 15:45:34 UTC 2025","passed","Fri Dec 05 15:45:35 UTC 2025","","model_test","",""
"Test the 'predict' command of the instanovo_cli with no output path.","183","test_no_output_path[args0]","tests.unit_test","Fri Dec 05 15:45:19 UTC 2025","passed","Fri Dec 05 15:45:19 UTC 2025","","cli_test","",""
"Test residue sequence mass.","1","test_get_sequence_mass","tests.unit_test.utils_test","Fri Dec 05 15:44:24 UTC 2025","passed","Fri Dec 05 15:44:24 UTC 2025","","residues_test","",""
"Test peptide tokenizer.","1","test_tokenize","tests.unit_test.utils_test","Fri Dec 05 15:44:24 UTC 2025","passed","Fri Dec 05 15:44:24 UTC 2025","","residues_test","",""
"Tests splitting of peptide.","1","test_split_peptide","tests.unit_test.utils_test","Fri Dec 05 15:44:24 UTC 2025","passed","Fri Dec 05 15:44:24 UTC 2025","","metrics_test","",""
"Test diffusion model inference.","3000","test_diffusion_model_inference","tests.integration","Fri Dec 05 15:44:13 UTC 2025","passed","Fri Dec 05 15:44:16 UTC 2025","","instanovoplus_model_test","",""
"Tests s3 creation.","445","test_create_s3fs","tests.unit_test.utils_test","Fri Dec 05 15:45:33 UTC 2025","passed","Fri Dec 05 15:45:34 UTC 2025","","s3_test","",""
"Test with configuration that has existing values.","1","test_config_with_existing_values","tests.unit_test.utils_test","Fri Dec 05 15:44:24 UTC 2025","passed","Fri Dec 05 15:44:24 UTC 2025","TestEdgeCases","device_handler_test","",""
"Test the 'predict' command of the instanovo_cli with a nonexisting config name.","22","test_predict_nonexisting_config_name[cli1]","tests.unit_test","Fri Dec 05 15:45:23 UTC 2025","passed","Fri Dec 05 15:45:23 UTC 2025","","cli_test","",""
"Test successful execution of the CLI command.","11","test_cli_successful_execution","tests.scripts","Fri Dec 05 15:44:24 UTC 2025","passed","Fri Dec 05 15:44:24 UTC 2025","TestMainCommand","get_zenodo_record_test","",""
"Test the 'predict' command of the instanovo_cli with a nonexisting config name.","17","test_predict_nonexisting_config_name[cli2]","tests.unit_test","Fri Dec 05 15:45:32 UTC 2025","passed","Fri Dec 05 15:45:32 UTC 2025","","cli_test","",""
"Test diffusion model inference.","2221","test_diffusion_model_inference_refinement","tests.integration","Fri Dec 05 15:44:11 UTC 2025","passed","Fri Dec 05 15:44:13 UTC 2025","","instanovoplus_model_test","",""
"Test configuration updates for MPS device.","0","test_mps_config_updates","tests.unit_test.utils_test","Fri Dec 05 15:44:24 UTC 2025","passed","Fri Dec 05 15:44:24 UTC 2025","TestGetDeviceConfigUpdates","device_handler_test","",""
"Tests calculation of precision and recall at peptide- and AA-level.","1","test_compute_precision_recall","tests.unit_test.utils_test","Fri Dec 05 15:44:24 UTC 2025","passed","Fri Dec 05 15:44:24 UTC 2025","","metrics_test","",""
"Test when CUDA is available.","5","test_cuda_available","tests.unit_test.utils_test","Fri Dec 05 15:44:24 UTC 2025","passed","Fri Dec 05 15:44:24 UTC 2025","TestGetDeviceCapabilities","device_handler_test","",""
"Test full workflow on a system with MPS.","9","test_full_workflow_mps_system","tests.unit_test.utils_test","Fri Dec 05 15:44:24 UTC 2025","passed","Fri Dec 05 15:44:24 UTC 2025","TestIntegration","device_handler_test","",""
"Test the setting of the neptune API variable.","9","test_set_neptune_token","tests.unit_test.transformer_test","Fri Dec 05 15:45:19 UTC 2025","passed","Fri Dec 05 15:45:19 UTC 2025","","train_test","",""
"Test the 'predict' command of the instanovo_cli with a nonexisting config name.","26","test_predict_nonexisting_config_name[cli0]","tests.unit_test","Fri Dec 05 15:45:31 UTC 2025","passed","Fri Dec 05 15:45:31 UTC 2025","","cli_test","",""
"Test configuration updates for CUDA device.","0","test_cuda_config_updates","tests.unit_test.utils_test","Fri Dec 05 15:44:24 UTC 2025","passed","Fri Dec 05 15:44:24 UTC 2025","TestGetDeviceConfigUpdates","device_handler_test","",""
"Test incorrect file type error catching.","1","test_incorrect_file_error","tests.unit_test.scripts_test","Fri Dec 05 15:44:24 UTC 2025","passed","Fri Dec 05 15:44:24 UTC 2025","","update_ipc_format_test","",""
"Test downloading file from s3 using S3FileHandler.","8","test_s3_file_handler_download","tests.unit_test.utils_test","Fri Dec 05 15:45:34 UTC 2025","passed","Fri Dec 05 15:45:34 UTC 2025","","s3_test","",""
"Test spectrum dataset error catching.","17","test_spectrum_errors","tests.unit_test.transformer_test","Fri Dec 05 15:45:32 UTC 2025","passed","Fri Dec 05 15:45:32 UTC 2025","","dataset_test","",""
"Tests recall calculation at specified FDR.","10","test_find_recall_at_fdr","tests.unit_test.utils_test","Fri Dec 05 15:44:24 UTC 2025","passed","Fri Dec 05 15:44:24 UTC 2025","","metrics_test","",""
"Test spectrum dataset collate function.","1","test_dataset_collate","tests.unit_test.transformer_test","Fri Dec 05 15:45:33 UTC 2025","passed","Fri Dec 05 15:45:33 UTC 2025","","dataset_test","",""
"Test applying config when model section already exists.","1","test_apply_config_existing_model_section","tests.unit_test.utils_test","Fri Dec 05 15:44:24 UTC 2025","passed","Fri Dec 05 15:44:24 UTC 2025","TestApplyDeviceConfig","device_handler_test","",""
"Test getting local path for missing s3 file using S3FileHandler.","3","test_s3_file_handler_get_local_path_missing","tests.unit_test.utils_test","Fri Dec 05 15:45:33 UTC 2025","passed","Fri Dec 05 15:45:33 UTC 2025","","s3_test","",""
"Test CLI skips download when target directory exists with matching record ID.","3","test_cli_skips_when_directory_exists","tests.scripts","Fri Dec 05 15:44:24 UTC 2025","passed","Fri Dec 05 15:44:24 UTC 2025","TestMainCommand","get_zenodo_record_test","",""
"Test function that checks if a sequence matches the precursor mass within some tolerance.","1","test_precursor_match","tests.unit_test.utils_test","Fri Dec 05 15:44:24 UTC 2025","passed","Fri Dec 05 15:44:24 UTC 2025","","metrics_test","",""
"Test when neither CUDA nor MPS are available.","4","test_neither_available","tests.unit_test.utils_test","Fri Dec 05 15:44:24 UTC 2025","passed","Fri Dec 05 15:44:24 UTC 2025","TestGetDeviceCapabilities","device_handler_test","",""
"Tests converting and saving an input file to a parquet file using the CLI.","59","test_convert_command","tests.unit_test.scripts_test","Fri Dec 05 15:44:24 UTC 2025","passed","Fri Dec 05 15:44:24 UTC 2025","","convert_to_sdf_test","",""
"Test residue set remapping update.","0","test_update_remapping","tests.unit_test.utils_test","Fri Dec 05 15:44:24 UTC 2025","passed","Fri Dec 05 15:44:24 UTC 2025","","residues_test","",""
"Test spectrum data frame basic initialisation.","1","test_init","tests.unit_test.utils_test","Fri Dec 05 15:44:16 UTC 2025","passed","Fri Dec 05 15:44:16 UTC 2025","","data_handler_test","",""
"Test data handler error catching.","2","test_errors","tests.unit_test.utils_test","Fri Dec 05 15:44:16 UTC 2025","passed","Fri Dec 05 15:44:16 UTC 2025","","data_handler_test","",""
"Test mgf to parquet conversion with lazy loading.","21","test_mgf_to_parquet","tests.unit_test.utils_test","Fri Dec 05 15:44:16 UTC 2025","passed","Fri Dec 05 15:44:16 UTC 2025","","data_handler_test","",""
"Test applying config with auto-detected device.","2","test_apply_config_auto_detect","tests.unit_test.utils_test","Fri Dec 05 15:44:24 UTC 2025","passed","Fri Dec 05 15:44:24 UTC 2025","TestApplyDeviceConfig","device_handler_test","",""
"Tests peptide matches calculation.","2","test_get_peptide_matches","tests.unit_test.utils_test","Fri Dec 05 15:44:24 UTC 2025","passed","Fri Dec 05 15:44:24 UTC 2025","","metrics_test","",""
"Test peptide metric class initialisation.","0","test_init_metrics","tests.unit_test.utils_test","Fri Dec 05 15:44:24 UTC 2025","passed","Fri Dec 05 15:44:24 UTC 2025","","metrics_test","",""
"Test mzml to parquet conversion.","20","test_mzml_to_parquet","tests.unit_test.utils_test","Fri Dec 05 15:44:16 UTC 2025","passed","Fri Dec 05 15:44:16 UTC 2025","","data_handler_test","",""
"Test fetching item at specified index.","4","test_get_item","tests.unit_test.utils_test","Fri Dec 05 15:44:16 UTC 2025","passed","Fri Dec 05 15:44:16 UTC 2025","","data_handler_test","",""
"Test the 'predict' command of the instanovo_cli with no output path.","176","test_no_output_path[args1]","tests.unit_test","Fri Dec 05 15:45:31 UTC 2025","passed","Fri Dec 05 15:45:31 UTC 2025","","cli_test","",""
"Test successful download of a Zenodo record.","4","test_get_zenodo_success","tests.scripts","Fri Dec 05 15:44:24 UTC 2025","passed","Fri Dec 05 15:44:24 UTC 2025","TestZenodoDownload","get_zenodo_record_test","",""
"Test the 'predict' command of the instanovo_cli with a nonexisting data path.","177","test_nonexisting_data_path[args1]","tests.unit_test","Fri Dec 05 15:45:22 UTC 2025","passed","Fri Dec 05 15:45:23 UTC 2025","","cli_test","",""
"Test the 'predict' command of the instanovo plus cli with a non existing file.","180","test_instanovoplus_model[args0-.ckpt-\\*.yaml, \\*.pt]","tests.unit_test","Fri Dec 05 15:45:27 UTC 2025","passed","Fri Dec 05 15:45:27 UTC 2025","","cli_test","",""
"Tests amino acid mass sum.","1","test_mass","tests.unit_test.utils_test","Fri Dec 05 15:44:24 UTC 2025","passed","Fri Dec 05 15:44:24 UTC 2025","","metrics_test","",""
"Test residue detokenizer.","0","test_detokenize","tests.unit_test.utils_test","Fri Dec 05 15:44:24 UTC 2025","passed","Fri Dec 05 15:44:24 UTC 2025","","residues_test","",""
"Test spectrum data frame specified initialisation.","2","test_spec_init","tests.unit_test.utils_test","Fri Dec 05 15:44:17 UTC 2025","passed","Fri Dec 05 15:44:17 UTC 2025","","data_handler_test","",""
"Tests calculation of amino-acid level error-rate.","1","test_compute_aa_er","tests.unit_test.utils_test","Fri Dec 05 15:44:24 UTC 2025","passed","Fri Dec 05 15:44:24 UTC 2025","","metrics_test","",""
"Test data checker.","3","test_check_type_spec","tests.unit_test.utils_test","Fri Dec 05 15:44:16 UTC 2025","passed","Fri Dec 05 15:44:16 UTC 2025","","data_handler_test","",""
"Test the 'predict' command of the instanovo_cli with a nonexisting data path.","176","test_nonexisting_data_path[args2]","tests.unit_test","Fri Dec 05 15:45:23 UTC 2025","passed","Fri Dec 05 15:45:23 UTC 2025","","cli_test","",""
"Test greedy decoder initialisation.","1","test_greedy_decoder","tests.unit_test.inference_test","Fri Dec 05 15:43:47 UTC 2025","passed","Fri Dec 05 15:43:47 UTC 2025","","greedy_search_test","",""
"Test device detection when CUDA is available.","2","test_detect_cuda","tests.unit_test.utils_test","Fri Dec 05 15:44:24 UTC 2025","passed","Fri Dec 05 15:44:24 UTC 2025","TestDetectDevice","device_handler_test","",""
"Test spectrum data frame lazy loading.","15","test_lazy","tests.unit_test.utils_test","Fri Dec 05 15:44:17 UTC 2025","passed","Fri Dec 05 15:44:17 UTC 2025","","data_handler_test","",""
"Tests novor amino acid match algorithm.","1","test_novor_match","tests.unit_test.utils_test","Fri Dec 05 15:44:24 UTC 2025","passed","Fri Dec 05 15:44:24 UTC 2025","","metrics_test","",""
"Test spectrum preprocessing.","634","test_process_peaks","tests.unit_test.transformer_test","Fri Dec 05 15:45:32 UTC 2025","passed","Fri Dec 05 15:45:32 UTC 2025","","dataset_test","",""
"Test transformer inference when dropping a row.","1828","test_row_drop","tests.unit_test.transformer_test","Fri Dec 05 15:44:30 UTC 2025","passed","Fri Dec 05 15:44:32 UTC 2025","","predict_test","",""
"Test the 'predict' command of the instanovo_cli with no output path.","174","test_no_output_path[args2]","tests.unit_test","Fri Dec 05 15:45:32 UTC 2025","passed","Fri Dec 05 15:45:32 UTC 2025","","cli_test","",""
"Test that model config is skipped when model section doesn't exist.","0","test_model_config_skip_when_missing","tests.unit_test.utils_test","Fri Dec 05 15:44:24 UTC 2025","passed","Fri Dec 05 15:44:24 UTC 2025","TestEdgeCases","device_handler_test","",""
"Test spectrum data frame parquet creation and initialisation.","12","test_parquet_init","tests.unit_test.utils_test","Fri Dec 05 15:44:16 UTC 2025","passed","Fri Dec 05 15:44:16 UTC 2025","","data_handler_test","",""
"Test transformer model inference.","834","test_transformer_model_inference","tests.integration","Fri Dec 05 15:44:23 UTC 2025","passed","Fri Dec 05 15:44:24 UTC 2025","","instanovo_model_test","",""
"Test the 'diffusion predict' command of the instanovo_cli.","3270","test_predict_diffusion","tests.unit_test","Fri Dec 05 15:45:27 UTC 2025","passed","Fri Dec 05 15:45:31 UTC 2025","","cli_test","",""
"Test residue set initialisation.","0","test_init","tests.unit_test.utils_test","Fri Dec 05 15:44:24 UTC 2025","passed","Fri Dec 05 15:44:24 UTC 2025","","residues_test","",""
"Test transformer inference with beam search.","860","test_preds_with_beam","tests.unit_test.transformer_test","Fri Dec 05 15:44:34 UTC 2025","passed","Fri Dec 05 15:44:34 UTC 2025","","predict_test","",""
"Test CLI with different parameters.","8","test_cli_with_different_parameters[https://zenodo.org/records/12345/files/test.zip-other.zip-./other]","tests.scripts","Fri Dec 05 15:44:24 UTC 2025","passed","Fri Dec 05 15:44:24 UTC 2025","","get_zenodo_record_test","",""
"Test when MPS is available and requested.","6","test_mps_available_and_requested","tests.unit_test.utils_test","Fri Dec 05 15:44:24 UTC 2025","passed","Fri Dec 05 15:44:24 UTC 2025","TestValidateAndConfigureDevice","device_handler_test","",""
"Test main function with different parameters.","6","test_main_with_parameters","tests.scripts","Fri Dec 05 15:44:24 UTC 2025","passed","Fri Dec 05 15:44:24 UTC 2025","TestMainCommand","get_zenodo_record_test","",""
"Test the transformer training function with different run configurations.","31519","test_train","tests.unit_test.transformer_test","Fri Dec 05 15:44:47 UTC 2025","passed","Fri Dec 05 15:45:19 UTC 2025","","train_test","",""
"Test the neptune summary writer function.","5","test_neptune_summary_writer","tests.unit_test.transformer_test","Fri Dec 05 15:44:47 UTC 2025","passed","Fri Dec 05 15:44:47 UTC 2025","","train_test","",""
"Test mgf to parquet conversion where no scan number column is present.","9","test_mgf_to_parquet_no_scan_number","tests.unit_test.utils_test","Fri Dec 05 15:44:16 UTC 2025","passed","Fri Dec 05 15:44:16 UTC 2025","","data_handler_test","",""
"Test multi scale peak embedding errors.","3","test_peak_embed_errors","tests.unit_test.transformer_test","Fri Dec 05 15:44:47 UTC 2025","passed","Fri Dec 05 15:44:47 UTC 2025","","layers_test","",""
"Test successful extraction of a zip file.","4","test_unzip_zenodo_success","tests.scripts","Fri Dec 05 15:44:24 UTC 2025","passed","Fri Dec 05 15:44:24 UTC 2025","TestZenodoDownload","get_zenodo_record_test","",""
"Test device detection when neither CUDA nor MPS are available.","2","test_detect_cpu","tests.unit_test.utils_test","Fri Dec 05 15:44:24 UTC 2025","passed","Fri Dec 05 15:44:24 UTC 2025","TestDetectDevice","device_handler_test","",""
"Test positional encoding specified initialisation.","0","test_pos_enc_spec","tests.unit_test.transformer_test","Fri Dec 05 15:44:47 UTC 2025","passed","Fri Dec 05 15:44:47 UTC 2025","","layers_test","",""
"Test the 'predict' command of the instanovo_cli.","1935","test_predict","tests.unit_test","Fri Dec 05 15:45:23 UTC 2025","passed","Fri Dec 05 15:45:25 UTC 2025","","cli_test","",""
"Test configuration updates for CPU device.","1","test_cpu_config_updates","tests.unit_test.utils_test","Fri Dec 05 15:44:24 UTC 2025","passed","Fri Dec 05 15:44:24 UTC 2025","TestGetDeviceConfigUpdates","device_handler_test","",""
"Test code to update an ipc file from the old format to the new format.","9","test_update_ipc_format","tests.unit_test.scripts_test","Fri Dec 05 15:44:24 UTC 2025","passed","Fri Dec 05 15:44:24 UTC 2025","","update_ipc_format_test","",""
"Test check_device without config parameter.","1","test_check_device_no_config","tests.unit_test.utils_test","Fri Dec 05 15:44:24 UTC 2025","passed","Fri Dec 05 15:44:24 UTC 2025","TestCheckDeviceBackwardCompatibility","device_handler_test","",""
"Test residue encoder.","1","test_encoder","tests.unit_test.utils_test","Fri Dec 05 15:44:24 UTC 2025","passed","Fri Dec 05 15:44:24 UTC 2025","","residues_test","",""
"Tests conversion of local directory to s3 output path using S3FileHandler.","3","test_s3_file_handler_convert_to_s3_output","tests.unit_test.utils_test","Fri Dec 05 15:45:34 UTC 2025","passed","Fri Dec 05 15:45:34 UTC 2025","","s3_test","",""
"Test greedy decoder decode function.","2597","test_decode","tests.unit_test.inference_test","Fri Dec 05 15:43:47 UTC 2025","passed","Fri Dec 05 15:43:50 UTC 2025","","greedy_search_test","",""
"Test linear warmup scheduler.","0","test_warmup_scheduler","tests.unit_test.transformer_test","Fri Dec 05 15:45:19 UTC 2025","passed","Fri Dec 05 15:45:19 UTC 2025","","train_test","",""
"Tests mass error calculation.","1","test_calc_mass_error","tests.unit_test.utils_test","Fri Dec 05 15:44:24 UTC 2025","passed","Fri Dec 05 15:44:24 UTC 2025","","metrics_test","",""
"Test get length.","1","test_length","tests.unit_test.utils_test","Fri Dec 05 15:44:16 UTC 2025","passed","Fri Dec 05 15:44:16 UTC 2025","","data_handler_test","",""
"Test spectrum dataset default initialisation.","31","test_dataset_default_init","tests.unit_test.transformer_test","Fri Dec 05 15:45:33 UTC 2025","passed","Fri Dec 05 15:45:33 UTC 2025","","dataset_test","",""
"Test mzxml to parquet conversion.","17","test_mzxml_to_parquet","tests.unit_test.utils_test","Fri Dec 05 15:44:16 UTC 2025","passed","Fri Dec 05 15:44:16 UTC 2025","","data_handler_test","",""
"Test sanitise peptide sequence.","1","test_sanitise_peptides","tests.unit_test.utils_test","Fri Dec 05 15:44:16 UTC 2025","passed","Fri Dec 05 15:44:16 UTC 2025","","data_handler_test","",""
"Test configuration updates for unknown device.","1","test_unknown_device","tests.unit_test.utils_test","Fri Dec 05 15:44:24 UTC 2025","passed","Fri Dec 05 15:44:24 UTC 2025","TestGetDeviceConfigUpdates","device_handler_test","",""
"Test the main command help text is displayed.","15","test_main_help[args2-Run predictions or train with only the transformer-based InstaNovo model.]","tests.unit_test","Fri Dec 05 15:45:32 UTC 2025","passed","Fri Dec 05 15:45:32 UTC 2025","","cli_test","",""
"Test the 'predict' command of the instanovo_cli with no data path.","192","test_no_data_path[args2]","tests.unit_test","Fri Dec 05 15:45:20 UTC 2025","passed","Fri Dec 05 15:45:20 UTC 2025","","cli_test","",""
"Test the 'predict' command of the instanovo_cli.","1103","test_predict_transformer_pipeline","tests.unit_test","Fri Dec 05 15:45:19 UTC 2025","passed","Fri Dec 05 15:45:20 UTC 2025","","cli_test","",""
"Test training an InstaNovo model and doing inference end-to-end.","0","test_train_model","tests.integration","Fri Dec 05 15:44:24 UTC 2025","skipped","Fri Dec 05 15:44:24 UTC 2025","","instanovo_model_train_test","",""
"Test the 'predict' command of the instanovo plus cli with a non existing file.","180","test_instanovoplus_model[args0-.yaml-\\*.ckpt, \\*.pt]","tests.unit_test","Fri Dec 05 15:45:31 UTC 2025","passed","Fri Dec 05 15:45:32 UTC 2025","","cli_test","",""
"Test knapsack beam search decoder initialisation.","4428","test_init","tests.unit_test.inference_test","Fri Dec 05 15:44:24 UTC 2025","passed","Fri Dec 05 15:44:29 UTC 2025","","knapsack_beam_search_test","",""
"Test the 'predict' command of the instanovo plus cli with a non existing file.","181","test_instanovoplus_model[args0-.txt-\\*.ckpt, \\*.yaml, \\*.pt]","tests.unit_test","Fri Dec 05 15:45:25 UTC 2025","passed","Fri Dec 05 15:45:25 UTC 2025","","cli_test","",""
"Test CLI with different parameters.","7","test_cli_with_different_parameters[https://zenodo.org/records/17816199/files/custom.zip-custom.zip-./custom]","tests.scripts","Fri Dec 05 15:44:24 UTC 2025","passed","Fri Dec 05 15:44:24 UTC 2025","","get_zenodo_record_test","",""
"Test the 'predict' command of the instanovo_cli with a nonexisting instanovo model.","181","test_model[args2-InstaNovo]","tests.unit_test","Fri Dec 05 15:45:31 UTC 2025","passed","Fri Dec 05 15:45:31 UTC 2025","","cli_test","",""
"Test full workflow on a system with CUDA.","5","test_full_workflow_cuda_system","tests.unit_test.utils_test","Fri Dec 05 15:44:24 UTC 2025","passed","Fri Dec 05 15:44:24 UTC 2025","TestIntegration","device_handler_test","",""
"Tests environment variable checks.","2","test_s3_enabled","tests.unit_test.utils_test","Fri Dec 05 15:45:34 UTC 2025","passed","Fri Dec 05 15:45:34 UTC 2025","","s3_test","",""
"Test getting local path for missing s3 file with missing_ok=True using S3FileHandler.","3","test_s3_file_handler_get_local_path_missing_ok","tests.unit_test.utils_test","Fri Dec 05 15:45:34 UTC 2025","passed","Fri Dec 05 15:45:34 UTC 2025","","s3_test","",""
"Test residue sequence length.","0","test_length","tests.unit_test.utils_test","Fri Dec 05 15:44:24 UTC 2025","passed","Fri Dec 05 15:44:24 UTC 2025","","residues_test","",""
"Test check_device with None config.","1","test_check_device_none_config","tests.unit_test.utils_test","Fri Dec 05 15:44:24 UTC 2025","passed","Fri Dec 05 15:44:24 UTC 2025","TestCheckDeviceBackwardCompatibility","device_handler_test","",""
"Test applying config with specified device.","1","test_apply_config_specified_device","tests.unit_test.utils_test","Fri Dec 05 15:44:24 UTC 2025","passed","Fri Dec 05 15:44:24 UTC 2025","TestApplyDeviceConfig","device_handler_test","",""
